{
  "$schema": "./waste-streams.schema.json",
  "version": "1.0.0",
  "updated": "2026-08-01",
  "description": "Canonical, jurisdiction-independent waste-stream ontology. Stream ids are stable identifiers and MUST NOT be renamed once published; regions map local reality onto these ids. All human-readable text is referenced by i18n key and lives in web/src/i18n/<locale>.json.",

  "colors": [
    { "id": "blue",        "hex_ref": "#1F4FA8" },
    { "id": "green",       "hex_ref": "#1E7A3C" },
    { "id": "brown",       "hex_ref": "#6B4423" },
    { "id": "black",       "hex_ref": "#1A1A1A" },
    { "id": "grey",        "hex_ref": "#8A8A8A" },
    { "id": "yellow",      "hex_ref": "#F2C200" },
    { "id": "orange",      "hex_ref": "#E8720C" },
    { "id": "red",         "hex_ref": "#C1272D" },
    { "id": "white",       "hex_ref": "#F2F2F2" },
    { "id": "transparent", "hex_ref": null },
    { "id": "metal",       "hex_ref": "#9BA3A8" }
  ],

  "form_factors": [
    { "id": "wheelie_small",  "i18n_key": "form.wheelie_small",  "capacity_l": [80, 240],   "note": "Two-wheel household bin. Lid colour is usually the semantic signal; body is often black or grey." },
    { "id": "wheelie_large",  "i18n_key": "form.wheelie_large",  "capacity_l": [660, 1100], "note": "Four-wheel communal container, typical of apartment blocks." },
    { "id": "igloo",          "i18n_key": "form.igloo",          "capacity_l": [1500, 3000], "note": "Bottle-bank / igloo. Apertures may be separately coloured – see aperture detection, v2." },
    { "id": "underground",    "i18n_key": "form.underground",    "capacity_l": [3000, 5000], "note": "Underground container; only the drop column is visible." },
    { "id": "textile_bank",   "i18n_key": "form.textile_bank",   "capacity_l": null,        "note": "Clothing/shoe donation container. Often operator-branded rather than colour-coded." },
    { "id": "street_basket",  "i18n_key": "form.street_basket",  "capacity_l": [30, 120],   "note": "Public litter basket. Almost always residual; never a sorting target." },
    { "id": "sack",           "i18n_key": "form.sack",           "capacity_l": null,        "note": "Kerbside sack, e.g. Gelber Sack. Colour is the whole signal." },
    { "id": "crate",          "i18n_key": "form.crate",          "capacity_l": [20, 90],    "note": "Open crate or box, e.g. paper crates in some regions." },
    { "id": "wall_unit",      "i18n_key": "form.wall_unit",      "capacity_l": null,        "note": "In-store or wall-mounted collection box: batteries, small e-waste, bulbs." },
    { "id": "container_bank", "i18n_key": "form.container_bank", "capacity_l": null,        "note": "Group detection: a row of three or more containers. Resolves to a list of child bins, not a single stream." }
  ],

  "families": [
    { "id": "residual",    "i18n_key": "family.residual" },
    { "id": "recyclable",  "i18n_key": "family.recyclable" },
    { "id": "organic",     "i18n_key": "family.organic" },
    { "id": "special",     "i18n_key": "family.special" },
    { "id": "reuse",       "i18n_key": "family.reuse" },
    { "id": "meta",        "i18n_key": "family.meta" }
  ],

  "streams": [
    {
      "id": "residual",
      "family": "residual",
      "i18n_key": "stream.residual",
      "icon": "residual",
      "typical_colors": ["black", "grey"],
      "accepted": ["hygiene_products", "nappies", "cigarette_butts", "vacuum_bags", "broken_ceramics", "ashes_cold", "pet_litter", "soiled_paper", "rubber", "leather_scraps"],
      "rejected": ["batteries", "electronics_small", "paint", "medicines", "glass_bottles", "garden_waste"],
      "common_mistakes": ["batteries", "electronics_small"],
      "confusable_with": ["packaging", "bio"],
      "note_key": "stream.residual.note"
    },
    {
      "id": "paper",
      "family": "recyclable",
      "i18n_key": "stream.paper",
      "icon": "paper",
      "typical_colors": ["blue", "green"],
      "accepted": ["newspapers", "magazines", "cardboard", "paper_bags", "envelopes", "books", "office_paper", "cereal_boxes"],
      "rejected": ["beverage_cartons", "thermal_receipts", "soiled_paper", "paper_towels", "wallpaper", "photos", "baking_paper", "pizza_boxes_greasy"],
      "common_mistakes": ["beverage_cartons", "thermal_receipts", "pizza_boxes_greasy"],
      "confusable_with": ["packaging", "residual"],
      "note_key": "stream.paper.note"
    },
    {
      "id": "bio",
      "family": "organic",
      "i18n_key": "stream.bio",
      "icon": "bio",
      "typical_colors": ["brown", "green"],
      "accepted": ["food_scraps", "vegetable_peel", "coffee_grounds", "tea_bags_paper", "eggshells", "spoiled_food", "small_plant_cuttings", "nut_shells"],
      "rejected": ["bioplastic_bags", "plastic_bags", "pet_litter", "vacuum_bags", "ashes_cold", "cooked_bones_large", "liquids"],
      "common_mistakes": ["bioplastic_bags", "pet_litter"],
      "confusable_with": ["garden", "residual"],
      "note_key": "stream.bio.note"
    },
    {
      "id": "packaging",
      "family": "recyclable",
      "i18n_key": "stream.packaging",
      "icon": "packaging",
      "typical_colors": ["yellow", "orange"],
      "accepted": ["plastic_packaging", "beverage_cartons", "metal_cans", "aluminium_foil", "yoghurt_pots", "plastic_film", "crown_caps", "tubes"],
      "rejected": ["non_packaging_plastic", "toys", "nappies", "electronics_small", "glass_bottles", "paper"],
      "common_mistakes": ["non_packaging_plastic", "toys"],
      "confusable_with": ["residual", "metal"],
      "note_key": "stream.packaging.note"
    },
    {
      "id": "glass_clear",
      "family": "recyclable",
      "i18n_key": "stream.glass_clear",
      "icon": "glass",
      "typical_colors": ["white", "transparent"],
      "accepted": ["glass_bottles_clear", "glass_jars_clear"],
      "rejected": ["drinking_glasses", "window_glass", "ceramics", "mirrors", "light_bulbs", "bottle_caps", "heat_resistant_glass"],
      "common_mistakes": ["drinking_glasses", "ceramics", "light_bulbs"],
      "confusable_with": ["glass_green", "glass_brown", "glass_mixed"],
      "note_key": "stream.glass_clear.note"
    },
    {
      "id": "glass_green",
      "family": "recyclable",
      "i18n_key": "stream.glass_green",
      "icon": "glass",
      "typical_colors": ["green"],
      "accepted": ["glass_bottles_green", "glass_jars_green", "glass_bottles_blue", "glass_bottles_red"],
      "rejected": ["drinking_glasses", "window_glass", "ceramics", "mirrors", "light_bulbs", "heat_resistant_glass"],
      "common_mistakes": ["ceramics"],
      "confusable_with": ["glass_clear", "glass_brown"],
      "note_key": "stream.glass_green.note"
    },
    {
      "id": "glass_brown",
      "family": "recyclable",
      "i18n_key": "stream.glass_brown",
      "icon": "glass",
      "typical_colors": ["brown"],
      "accepted": ["glass_bottles_brown", "glass_jars_brown"],
      "rejected": ["drinking_glasses", "window_glass", "ceramics", "mirrors", "light_bulbs", "heat_resistant_glass"],
      "common_mistakes": ["ceramics"],
      "confusable_with": ["glass_clear", "glass_green"],
      "note_key": "stream.glass_brown.note"
    },
    {
      "id": "glass_mixed",
      "family": "recyclable",
      "i18n_key": "stream.glass_mixed",
      "icon": "glass",
      "typical_colors": ["green", "white"],
      "accepted": ["glass_bottles_clear", "glass_bottles_green", "glass_bottles_brown", "glass_jars_clear"],
      "rejected": ["drinking_glasses", "window_glass", "ceramics", "mirrors", "light_bulbs"],
      "common_mistakes": ["ceramics", "drinking_glasses"],
      "confusable_with": ["glass_clear", "glass_green", "glass_brown"],
      "note_key": "stream.glass_mixed.note"
    },
    {
      "id": "metal",
      "family": "recyclable",
      "i18n_key": "stream.metal",
      "icon": "metal",
      "typical_colors": ["grey", "metal", "blue"],
      "accepted": ["metal_cans", "aluminium_foil", "metal_lids", "small_scrap_metal", "pots_pans"],
      "rejected": ["aerosol_cans_full", "paint_tins_full", "electronics_small", "batteries"],
      "common_mistakes": ["aerosol_cans_full"],
      "confusable_with": ["packaging", "bulky"],
      "note_key": "stream.metal.note"
    },
    {
      "id": "textiles",
      "family": "reuse",
      "i18n_key": "stream.textiles",
      "icon": "textiles",
      "typical_colors": ["white", "green", "grey", "orange"],
      "accepted": ["clothing_wearable", "shoes_paired", "bed_linen", "towels", "belts", "handbags"],
      "rejected": ["wet_textiles", "soiled_textiles", "single_shoes", "carpet", "mattresses", "textile_scraps"],
      "common_mistakes": ["wet_textiles", "carpet"],
      "confusable_with": ["residual", "bulky"],
      "note_key": "stream.textiles.note"
    },
    {
      "id": "ewaste",
      "family": "special",
      "i18n_key": "stream.ewaste",
      "icon": "ewaste",
      "typical_colors": ["red", "grey", "orange"],
      "accepted": ["electronics_small", "cables", "phones", "chargers", "toys_electronic", "light_bulbs_led"],
      "rejected": ["batteries_loose", "large_appliances", "lamps_with_batteries"],
      "common_mistakes": ["batteries_loose"],
      "confusable_with": ["batteries", "bulky", "residual"],
      "note_key": "stream.ewaste.note"
    },
    {
      "id": "batteries",
      "family": "special",
      "i18n_key": "stream.batteries",
      "icon": "batteries",
      "typical_colors": ["red", "green", "grey"],
      "accepted": ["batteries", "button_cells", "rechargeable_batteries", "power_tool_batteries"],
      "rejected": ["damaged_lithium", "electronics_small", "light_bulbs"],
      "common_mistakes": ["damaged_lithium"],
      "confusable_with": ["ewaste"],
      "note_key": "stream.batteries.note"
    },
    {
      "id": "deposit_return",
      "family": "reuse",
      "i18n_key": "stream.deposit_return",
      "icon": "deposit",
      "typical_colors": ["grey", "metal", "white"],